{
  "baseline": {
    "splunk": {
      "schedule": {
        "cron_schedule": "",
        "earliest_time": "-30d@d",
        "latest_time": "-10m@m"
      },
      "search": "sourcetype=aws:cloudtrail errorCode=success | rename userName as identity | search NOT [inputlookup identity_lookup_expanded | fields identity] | stats count by identity | table identity | outputlookup aws_service_accounts | stats count"
    }
  },
  "creation_date": "2018-03-12",
  "data_metadata": {
    "data_source": [
      "AWS CloudTrail logs"
    ],
    "data_sourcetypes": [
      "aws:cloudtrail"
    ],
    "providing_technologies": [
      "AWS"
    ]
  },
  "description": "This search looks for successful API activity in CloudTrail within the last 30 days, filters out known users from the identity table, and outputs values of users into `aws_service_accounts.csv` lookup file.",
  "eli5": "We first look for all successful CloudTrail API activity caused by types of user accounts and then remove all the events caused by users in the Identity table. This generates a list of accounts--typically service accounts--configured in your AWS environment. We output this list of service accounts to `aws_service_accounts.csv`.",
  "how_to_implement": "You must install the AWS App for Splunk (version 5.1.0 or later) and Splunk Add-on for AWS (version 4.4.0 or later), then configure your CloudTrail inputs. Please validate the service account entires in `aws_service_accounts.csv`, which is a lookup file created as a result of running this support search. Please remove the entries of service accounts that are not legitimate.",
  "id": "fc0edc95-ff2b-48b1-5f6f-63ga3789fd43",
  "known_false_positives": "",
  "maintainers": [
    {
      "company": "Splunk",
      "email": "bpatel@splunk.com",
      "name": "Bhavin Patel"
    }
  ],
  "modification_date": "2018-12-03",
  "name": "Create a list of approved AWS service accounts",
  "original_authors": [
    {
      "company": "Splunk",
      "email": "bpatel@splunk.com",
      "name": "Bhavin Patel"
    }
  ],
  "spec_version": 2,
  "type": "splunk",
  "version": "2.0"
}
